{
  "tesserae_compat": "1.x",
  "name": "CircuitPython client (indexed PNG)",
  "version": "0.1.0",
  "description": "Composition PNG quantized to the panel's palette and emitted as an indexed PNG sized for adafruit_imageload on CircuitPython microcontrollers. Output is 1-bit (mono panels) or 4-bit indexed (Spectra 6, 7-colour ACeP, or unknown gamuts fall back to Spectra 6). The device paints what arrives without an on-device quantize or dither pass, which keeps RAM usage on Pico-W class hardware to just the framebuffer plus a small streaming decode buffer.",
  "orientation": "composition",
  "mime": "image/png",
  "extension": "png",
  "topic_pattern": "tesserae/{device}/frame/png",
  "device": "circuitpython",
  "retain": false,
  "settings": [
    {
      "name": "dither",
      "type": "select",
      "label": "Dither mode",
      "default": "floyd-steinberg",
      "device_setting": true,
      "choices": [
        { "value": "floyd-steinberg", "label": "Floyd-Steinberg (smooth gradients)" },
        { "value": "none", "label": "None (nearest palette, no dither)" }
      ]
    },
    {
      "name": "contrast",
      "type": "slider",
      "label": "Pre-dither contrast",
      "default": 1.0,
      "min": 0.5,
      "max": 2.5,
      "step": 0.05,
      "device_setting": true,
      "help": "Push midtones toward black or white before the dither pass. 1.0 leaves the image alone; > 1.0 deepens contrast (good for photos with grey skies); < 1.0 softens (good for text-heavy dashboards)."
    }
  ]
}
